{
  "schema_version": "1",
  "letter": {
    "from": "ООО «Пример-Строй» (вымышленная компания)",
    "to": "Ассоциация «Пример СРО строителей»",
    "date": "2026-09-05",
    "number": "исх. 214",
    "summary": "Компания просит не учитывать договор ГП-14/2026 в совокупном размере обязательств по КФ ОДО.",
    "file": "pismo-214.pdf",
    "contract_number": "ГП-14/2026"
  },
  "claims": [
    {
      "type": "not_competitive",
      "quote": "Договор заключён без проведения торгов, поэтому не относится к договорам, учитываемым при расчёте совокупного размера обязательств.",
      "facts": {}
    },
    {
      "type": "works_not_in_list",
      "quote": "Значительная часть работ по договору — отделочные работы и благоустройство, которые не влияют на безопасность объекта и никогда не требовали допуска СРО.",
      "facts": {}
    },
    {
      "type": "price_includes_supply",
      "quote": "В цену договора включена поставка лифтового оборудования на 11 000 000 руб., которая не является строительными работами.",
      "facts": {}
    },
    {
      "type": "executed",
      "quote": "Работы по договору в значительной части выполнены и приняты заказчиком.",
      "facts": {}
    },
    {
      "type": "state_exempt",
      "quote": "Заказчик по договору является специализированным застройщиком с участием муниципалитета, что освобождает от требований о членстве.",
      "facts": {
        "contractor_is_state_entity": false
      }
    }
  ],
  "analysis": {
    "letter": {
      "from": "ООО «Пример-Строй» (вымышленная компания)",
      "to": "Ассоциация «Пример СРО строителей»",
      "date": "2026-09-05",
      "number": "исх. 214",
      "summary": "Компания просит не учитывать договор ГП-14/2026 в совокупном размере обязательств по КФ ОДО.",
      "file": "pismo-214.pdf",
      "contract_number": "ГП-14/2026"
    },
    "claims": [
      {
        "type": "not_competitive",
        "title": "Договор заключён без конкурентных процедур",
        "quote": "Договор заключён без проведения торгов, поэтому не относится к договорам, учитываемым при расчёте совокупного размера обязательств.",
        "status": "partially",
        "explanation": "По букве ч. 3 ст. 55.8 совокупный размер считается по конкурентным договорам, и прямой договор в него не входит. После 309-ФЗ (с 01.03.2026) уведомляются все договоры подряда, а из ч. 6 ст. 55.8 оговорка о конкурентных способах исключена. Итог зависит от положения о контроле СРО; довод нельзя ни принять, ни отклонить без него.",
        "basis": [
          "grk-55.8-3",
          "grk-55.8-6",
          "fz-309",
          "grk-55.13-n"
        ],
        "test": "Ч. 3 ст. 55.8 ГрК РФ говорит о договорах, заключённых с использованием конкурентных способов. С 01.03.2026 (309-ФЗ) уведомляются все договоры подряда, а из ч. 6 ст. 55.8 слова о конкурентных способах исключены; осталась ли эта оговорка в ч. 3 ст. 55.8 и ч. 13 ст. 55.16 — сверить по тексту. Итог зависит от положения о контроле конкретной СРО: скилл показывает обе выборки.",
        "missing": [],
        "facts_used": {
          "procurement": "direct"
        }
      },
      {
        "type": "works_not_in_list",
        "title": "Работы не влияют на безопасность объекта",
        "quote": "Значительная часть работ по договору — отделочные работы и благоустройство, которые не влияют на безопасность объекта и никогда не требовали допуска СРО.",
        "status": "partially",
        "explanation": "С 01.07.2017 членство определяется договором, а не видом работ: договор строительного подряда с застройщиком выше порога требует членства целиком. Для разделения цены довод учтён: 52 % цены — работы вне Перечня или со знаком «*» на обычном объекте — в «СРО» не идут, 48 % — идут.",
        "basis": [
          "fz-372",
          "grk-52-2.1",
          "order-624",
          "order-624-note",
          "letter-33838"
        ],
        "test": "С 01.07.2017 (372-ФЗ) обязанность членства определяется договором, а не видом работ: договор строительного подряда с застройщиком выше порога требует членства целиком. Перечень 624 применяется как классификатор при разделении цены на «СРО / не СРО». Возражение обосновано в двух случаях: (а) весь предмет договора — работы вне Перечня и не капитальный ремонт по п. 14.2 ст. 1 (косметический ремонт, благоустройство, вывески) — тогда это не строительный подряд на ОКС; (б) для разделения цены — строки вне Перечня и строки со звёздочкой на обычном объекте в «СРО» не идут.",
        "missing": [],
        "facts_used": {
          "works": [
            {
              "name": "Устройство монолитного железобетонного каркаса (фундаментная плита, стены, перекрытия)",
              "amount_rub": 62000000.0,
              "source": "приложение № 1, разд. 1"
            },
            {
              "name": "Кладка наружных и внутренних стен из газобетонных блоков",
              "amount_rub": 14000000.0,
              "source": "приложение № 1, разд. 2"
            },
            {
              "name": "Устройство кровли из рулонных материалов",
              "amount_rub": 6000000.0,
              "source": "приложение № 1, разд. 3"
            },
            {
              "name": "Устройство внутренних систем водоснабжения, канализации и отопления",
              "amount_rub": 12000000.0,
              "source": "приложение № 1, разд. 4"
            },
            {
              "name": "Устройство внутренних сетей электроснабжения",
              "amount_rub": 9000000.0,
              "source": "приложение № 1, разд. 5"
            },
            {
              "name": "Отделочные работы: штукатурка, шпатлёвка, окраска, плитка, полы",
              "amount_rub": 22000000.0,
              "source": "приложение № 1, разд. 6"
            },
            {
              "name": "Поставка лифтового оборудования",
              "amount_rub": 11000000.0,
              "source": "приложение № 1, разд. 7"
            },
            {
              "name": "Монтаж лифтов и пусконаладочные работы лифтов",
              "amount_rub": 4000000.0,
              "source": "приложение № 1, разд. 7"
            },
            {
              "name": "Устройство наружных сетей водопровода и канализации",
              "amount_rub": 5000000.0,
              "source": "приложение № 1, разд. 8"
            },
            {
              "name": "Благоустройство территории: озеленение, детская площадка, малые архитектурные формы",
              "amount_rub": 3000000.0,
              "source": "приложение № 1, разд. 9"
            }
          ],
          "object_category": "ordinary",
          "work_type": "construction"
        }
      },
      {
        "type": "price_includes_supply",
        "title": "В цену договора входят материалы и оборудование, их надо исключить",
        "quote": "В цену договора включена поставка лифтового оборудования на 11 000 000 руб., которая не является строительными работами.",
        "status": "unfounded",
        "explanation": "Материалы и оборудование, которыми подрядчик обеспечивает работы, — часть стоимости работ, а не отдельная поставка; вычесть их из цены договора нельзя. Исключается только выделенное в договоре самостоятельное обязательство поставки.",
        "basis": [
          "gk-704",
          "gk-745",
          "gk-421-3",
          "gk-740"
        ],
        "test": "Закон оперирует размером обязательств по договору. Исключить можно только самостоятельное обязательство поставки в смешанном договоре (п. 3 ст. 421 ГК РФ), выделенное в предмете и цене. Материалы, использованные подрядчиком при выполнении работ, — часть стоимости работ (ст. 704, 745 ГК РФ), из цены не вычитаются. При разделении цены по Перечню 624 поставка идёт в «не СРО», монтаж поставленного оборудования — в «СРО» по группе 23.",
        "missing": [],
        "facts_used": {
          "mixed_parts": []
        }
      },
      {
        "type": "executed",
        "title": "Договор исполнен",
        "quote": "Работы по договору в значительной части выполнены и приняты заказчиком.",
        "status": "partially",
        "explanation": "Принято по актам 39 400 000,00 ₽ из 148 000 000,00 ₽: исполненная часть из расчёта исключается, остаток 108 600 000,00 ₽ учитывается. Договор не снимается с учёта до итогового акта.",
        "basis": [
          "grk-55.13-4",
          "gk-753"
        ],
        "test": "Обязательства, признанные исполненными на основании акта приёмки, в фактический совокупный размер не включаются (ч. 4 ст. 55.13 ГрК РФ; ст. 753 ГК РФ). Нужен акт: КС-2/КС-11/итоговый акт приёмки. Частичное исполнение уменьшает остаток, но не снимает договор с учёта.",
        "missing": [],
        "facts_used": {
          "has_final_act": false,
          "executed_rub": 39400000.0,
          "price_rub": 148000000.0
        }
      },
      {
        "type": "state_exempt",
        "title": "Исключение для государственных и муниципальных организаций",
        "quote": "Заказчик по договору является специализированным застройщиком с участием муниципалитета, что освобождает от требований о членстве.",
        "status": "unfounded",
        "explanation": "Исключение ч. 2.2 ст. 52 ГрК РФ касается подрядчика, а не заказчика. То, что заказчик — учреждение, от членства подрядчика не освобождает; напротив, учреждение-заказчик обычно застройщик или технический заказчик.",
        "basis": [
          "grk-52-2.2",
          "grk-52-2.1",
          "grk-1-22"
        ],
        "test": "Ч. 2.2 ст. 52 ГрК РФ освобождает от членства подрядчика, если он сам ГУП, МУП, государственное или муниципальное учреждение, организация с долей публично-правового образования более 50 % (и связанные лица) — при заказчиках, перечисленных в норме. Статус заказчика как учреждения членства подрядчика не отменяет.",
        "missing": [],
        "facts_used": {
          "contractor_is_state_entity": false,
          "customer_kind": "developer"
        }
      }
    ],
    "overall": "partially",